[
  {
    "source_id": "nice-headaches-cg150-2025",
    "resolved_url": "https://www.nice.org.uk/guidance/cg150/chapter/recommendations",
    "anchor": "content-start",
    "heading_path": [
      "Headaches in over 12s: diagnosis and management"
    ],
    "dom_section_identifier": "nice-headaches-cg150-2025-section-0001",
    "position": 0,
    "paragraph_or_text_span": "Clinical guideline Reference number: CG150 Published: 19 September 2012 Last updated: 03 June 2025 Download guidance (PDF)",
    "normalized_span_fingerprint": "b09e6720b9bd6fdf04ae21814bdb02ab431b5202ce1962342808717c99e7c154"
  },
  {
    "source_id": "nice-headaches-cg150-2025",
    "resolved_url": "https://www.nice.org.uk/guidance/cg150/chapter/recommendations",
    "anchor": "on-this-page",
    "heading_path": [
      "Headaches in over 12s: diagnosis and management",
      "On this page"
    ],
    "dom_section_identifier": "nice-headaches-cg150-2025-section-0002",
    "position": 1,
    "paragraph_or_text_span": "1.1 Assessment 1.2 Diagnosis 1.3 Management Terms used in this guideline",
    "normalized_span_fingerprint": "9979ed4bb4cb34f1b91074248cdaf8a264f8c609201f25222991c3f28a934eb9"
  },
  {
    "source_id": "nice-headaches-cg150-2025",
    "resolved_url": "https://www.nice.org.uk/guidance/cg150/chapter/recommendations",
    "anchor": "recommendations",
    "heading_path": [
      "Headaches in over 12s: diagnosis and management",
      "Recommendations"
    ],
    "dom_section_identifier": "nice-headaches-cg150-2025-section-0003",
    "position": 2,
    "paragraph_or_text_span": "People have the right to be involved in discussions and make informed decisions about their care, as described in NICE's information on making decisions about your care . Making decisions using NICE guidelines explains how we use words to show the strength (or certainty) of our recommendations, and has information about prescribing medicines (including off-label use), professional guidelines, stan",
    "normalized_span_fingerprint": "74e236dfb2aa410938e81668f5d1235612176cd5446a9645cb4501f893b15d71"
  },
  {
    "source_id": "nice-headaches-cg150-2025",
    "resolved_url": "https://www.nice.org.uk/guidance/cg150/chapter/recommendations",
    "anchor": null,
    "heading_path": [
      "Headaches in over 12s: diagnosis and management",
      "Recommendations",
      "1.1 Assessment",
      "1.1.1"
    ],
    "dom_section_identifier": "nice-headaches-cg150-2025-section-0005",
    "position": 4,
    "paragraph_or_text_span": "Evaluate people who present with headache and any of the following features, and consider the need for further investigations and/or referral: worsening headache with fever sudden‑onset headache reaching maximum intensity within 5 minutes new‑onset neurological deficit new‑onset cognitive dysfunction change in personality impaired level of consciousness recent (typically within the past 3 months) ",
    "normalized_span_fingerprint": "5829c5ff5542220adf78c57ebffd5b796d063d7868bc109ae201b9b2da077859"
  },
  {
    "source_id": "nice-headaches-cg150-2025",
    "resolved_url": "https://www.nice.org.uk/guidance/cg150/chapter/recommendations",
    "anchor": null,
    "heading_path": [
      "Headaches in over 12s: diagnosis and management",
      "Recommendations",
      "1.1 Assessment",
      "1.1.2"
    ],
    "dom_section_identifier": "nice-headaches-cg150-2025-section-0006",
    "position": 5,
    "paragraph_or_text_span": "Consider further investigations and/or referral for people who present with new‑onset headache and any of the following: compromised immunity, caused, for example, by HIV or immunosuppressive drugs age under 20 years and a history of malignancy a history of malignancy known to metastasise to the brain vomiting without other obvious cause. [2012]",
    "normalized_span_fingerprint": "b5a7d4f945919207ad7236355cd850996b30154d5eb930f1705955da2ef7ecff"
  },
  {
    "source_id": "nice-headaches-cg150-2025",
    "resolved_url": "https://www.nice.org.uk/guidance/cg150/chapter/recommendations",
    "anchor": null,
    "heading_path": [
      "Headaches in over 12s: diagnosis and management",
      "Recommendations",
      "1.1 Assessment",
      "1.1.3"
    ],
    "dom_section_identifier": "nice-headaches-cg150-2025-section-0007",
    "position": 6,
    "paragraph_or_text_span": "Consider using a headache diary to aid the diagnosis of primary headaches. [2012]",
    "normalized_span_fingerprint": "8c927528c9efc1bc9d4fa050a813ff323669b37db4a6b40f68c5357ca4d74661"
  },
  {
    "source_id": "nice-headaches-cg150-2025",
    "resolved_url": "https://www.nice.org.uk/guidance/cg150/chapter/recommendations",
    "anchor": null,
    "heading_path": [
      "Headaches in over 12s: diagnosis and management",
      "Recommendations",
      "1.1 Assessment",
      "1.1.4"
    ],
    "dom_section_identifier": "nice-headaches-cg150-2025-section-0008",
    "position": 7,
    "paragraph_or_text_span": "If a headache diary is used, ask the person to record the following for a minimum of 8 weeks: frequency, duration and severity of headaches any associated symptoms all prescribed and over the counter medications taken to relieve headaches possible precipitants relationship of headaches to menstruation. [2012]",
    "normalized_span_fingerprint": "6ba51437a499ad8fce92949fd90301214af4e5ee110f1b21cf1d2e2b8751c578"
  },
  {
    "source_id": "nice-headaches-cg150-2025",
    "resolved_url": "https://www.nice.org.uk/guidance/cg150/chapter/recommendations",
    "anchor": null,
    "heading_path": [
      "Headaches in over 12s: diagnosis and management",
      "Recommendations",
      "1.2 Diagnosis",
      "Tension‑type headache, migraine (with or without aura) and cluster headache",
      "1.2.1"
    ],
    "dom_section_identifier": "nice-headaches-cg150-2025-section-0011",
    "position": 10,
    "paragraph_or_text_span": "Diagnose tension‑type headache, migraine or cluster headache according to the headache features in table 1. Chronic migraine and chronic tension‑type headache commonly overlap. If there are any features of migraine, diagnose chronic migraine. See recommendations 1.2.2, 1.2.3 and 1.2.4 for more information on diagnosis of migraine with aura. [2012] Table 1 Headache features according to headache ty",
    "normalized_span_fingerprint": "48ec301ffef124964cee91874dd154be4a9e5964817385dd677ef3997c6a7d2f"
  },
  {
    "source_id": "nice-headaches-cg150-2025",
    "resolved_url": "https://www.nice.org.uk/guidance/cg150/chapter/recommendations",
    "anchor": null,
    "heading_path": [
      "Headaches in over 12s: diagnosis and management",
      "Recommendations",
      "1.2 Diagnosis",
      "Migraine with aura",
      "1.2.2"
    ],
    "dom_section_identifier": "nice-headaches-cg150-2025-section-0013",
    "position": 12,
    "paragraph_or_text_span": "Suspect aura in people who present with or without headache and with neurological symptoms that: are fully reversible and develop gradually, either alone or in succession, over at least 5 minutes and last for 5 to 60 minutes. [2012]",
    "normalized_span_fingerprint": "232c0193fae093a303021d94cb96b5eb94d96f7fbcf244991a97ccd90d1d98d4"
  },
  {
    "source_id": "nice-headaches-cg150-2025",
    "resolved_url": "https://www.nice.org.uk/guidance/cg150/chapter/recommendations",
    "anchor": null,
    "heading_path": [
      "Headaches in over 12s: diagnosis and management",
      "Recommendations",
      "1.2 Diagnosis",
      "Migraine with aura",
      "1.2.3"
    ],
    "dom_section_identifier": "nice-headaches-cg150-2025-section-0014",
    "position": 13,
    "paragraph_or_text_span": "Diagnose migraine with aura in people who present with or without headache and with 1 or more of the following typical aura symptoms that meet the criteria in recommendation 1.2.2: visual symptoms that may be positive (for example, flickering lights, spots or lines) and/or negative (for example, partial loss of vision) sensory symptoms that may be positive (for example, pins and needles) and/or ne",
    "normalized_span_fingerprint": "7601d0c75fcc317b16aa366cb6bb7efa41973ab28603b04ff3dae73af13995d3"
  },
  {
    "source_id": "nice-headaches-cg150-2025",
    "resolved_url": "https://www.nice.org.uk/guidance/cg150/chapter/recommendations",
    "anchor": null,
    "heading_path": [
      "Headaches in over 12s: diagnosis and management",
      "Recommendations",
      "1.2 Diagnosis",
      "Migraine with aura",
      "1.2.4"
    ],
    "dom_section_identifier": "nice-headaches-cg150-2025-section-0015",
    "position": 14,
    "paragraph_or_text_span": "Consider further investigations and/or referral for people who present with or without migraine headache and with any of the following atypical aura symptoms that meet the criteria in recommendation 1.2.2: motor weakness or double vision or visual symptoms affecting only 1 eye or poor balance or decreased level of consciousness. [2012]",
    "normalized_span_fingerprint": "135394d7f899732c47dae22a5130a91ee731cdd38443689f66b1e18eb1433731"
  },
  {
    "source_id": "nice-headaches-cg150-2025",
    "resolved_url": "https://www.nice.org.uk/guidance/cg150/chapter/recommendations",
    "anchor": null,
    "heading_path": [
      "Headaches in over 12s: diagnosis and management",
      "Recommendations",
      "1.2 Diagnosis",
      "Menstrual‑related migraine",
      "1.2.5"
    ],
    "dom_section_identifier": "nice-headaches-cg150-2025-section-0017",
    "position": 16,
    "paragraph_or_text_span": "Suspect menstrual‑related migraine if migraine occurs predominantly between 2 days before and 3 days after the start of menstruation in at least 2 out of 3 consecutive menstrual cycles. [2012]",
    "normalized_span_fingerprint": "e8bb21d8ae38311884d707a701e7ccecd5c817228be45c69262fc153b81d46db"
  },
  {
    "source_id": "nice-headaches-cg150-2025",
    "resolved_url": "https://www.nice.org.uk/guidance/cg150/chapter/recommendations",
    "anchor": null,